index,corrected_sentence
136576,වෙනත් අයුරකින් කිවහොත් බටහිර සෛද්ධාන්තික භෞතික විද්‍යාවෙහි කියැවෙන සංකල්පයක් හා බටහිර ගණිතයේ තාත්ත්වික සංඛ්‍යා අතර අනුරූපතාවක් තිබිය යුතු ය
141276,සෑදිය හැකි කෝණ සංඛ්‍යාව සෛද්ධාන්තික ව අනන්තයක් වෙයි
146516,සෛද්ධාන්තික ක්ෂෙත්‍රයකින් රාජකීය සංගමයේ අධිසාමාජිකත්වයක් ලැබු එකදු ලාංකිකයකු නැත
146517,සෛද්ධාන්තික ව නැත්නම් ප්‍රවාදාත්මක ව නම් අප ඉන්නේ පහළ මට්ටමක
28696,එමෙන් ම එය සෛද්ධාන්තික ව නව සංකල්පයක් හෝ ප්‍රවාදයක් ඉදිරිපත් කිරීමෙන් නොව කුරුළු උණ සම්බන්ධ වෛරසය පරීක්ෂණාගාරයේ දී හඳුනා ගැනීමෙන් ලබාගත්තකි
33334,එයට හේතුව මගේ මනසට එය බටහිර ගණිතය හෝ බටහිර ෙසෙද්ධාන්තික භෞතික විද්‍යාව හෝ තරම්වත් සෛද්ධාන්තික ව පොහොසත් නො වීම ය
49310,ඒ කිනම් අවස්ථාවක වුව ද දෘඪ වස්තුව දෘඪ නොවන වස්තුවකින් අඩුම තරමින් සෛද්ධාන්තික ව වෙන්කර ගන්නේ කෙසේ දැයි බටහිර භෞතික විද්‍යාඥයෝ දනිති
63050,ඔවුන් එසේ කරන්නේ සෛද්ධාන්තික ව ය
73277,කලක් තිස්සේ මෙරට විසඳීමට ඇති ප්‍රශ්නය ද ඉංගිරිසින් සෛද්ධාන්තික ව මෙරට අත්හැර යෑමෙන් පසුව මේ රටේ කටයුතු සිදුවිය යුත්තේ කාහට අවශ්‍ය අන්දමට ද යන්න ය
119934,මෙි ගැන මා ලියා ඇති මුත් ඒ සෛද්ධාන්තික ව ය
127594,යුද්දෙට නැති කඩුව කොස් කොටන්ට ද යන පිරුළ සිංහල බෞද්ධ සමාජයේ නිර්මාණය වූවක් බව පඬියෝ නොදනිත් ද  අප පඬියන්ගේ ප්‍රශ්නවලට පිළිතුරු දුන්නේ සෛද්ධාන්තික ව ය
146518,සෛද්ධාන්තික ව බටහිර විද්‍යාවට වැදගත් එකතු කිරීමක් කළ එකදු ලාංකිකයකු නැත
5038,අදත් අප අශ්වයන් ගැන කියනවා
19370,ඇයගේ මුතුන් මිත්තන් ඔස්සේ ආපස්සට යන අපට අවසානයේ දී ඒක සෛල ජීවයක් හමුවේ
49565,ඒ කියන්නේ සෛල ජීවත්වන බව
100667,බටහිර ජීව විද්‍යාවෙහි සෛල යන සංකල්පය නිර්මාණය කෙරී ඇත්තේ අංශු ආකෘතියෙහි ය
105588,බොහෝවිට මේ පර්යේශණ සඳහා යොදා ගැනෙන්නේ සතුන් හෝ කෘතිම සෛල පද්ධතිය
108676,මරණය කියන්නෙ මොකක් ද කියල බටහිර වෛද්‍ය විද්‍යාවට අනුව හරියට නොදන්න වෙලාවක සෛල මරණයට පත්වීම ගැන අවබෝධයක් නැති විට වෛරසය පවතින්න පුළුවන් ද වැඩෙන්න පුළුවන් ද යන්න ගැන බටහිර වෛද්‍ය විද්‍යාවට අනුව නිසි පිළිතුරු නැති විට කළ යුත්තේ මළ සිරුරු ආදාහනය කිරීම පමණයි
108921,මහා පිපිරුමෙන් පටන් ගෙන තාරකා ඔසසේ විවිධ පරමාණු නිර්මාණය කර ඇමයිනෝ අම්ල හා ප්‍රෝටීන නිර්මාණය වී ඒක සෛල ජීවියා නිර්මාණය වී ඩාවින්ගේ පරිණාමවාදයට අනුව මිනිසා නිර්මාණය වී විශ්වයට සේවය කිරීමක් මෙහි දී සිදුවෙයි
137185,වෛරසයට මිය ගිය අයකුගේ සෛලවල වැඩෙන්න පුළුවන් ද වැඩෙන්නෙ නැති වුණත් පවතින්න පුළුවන් ද මිය ගිය අයකුගේ ඒ ඒ සෛල මැරෙන්න කොතරම් වෙලාවක් ගන්නවා ද බටහිර වෛද්‍ය විද්‍යාවට අනුව ප්‍රාණියකු මෙහි දී මිනිසකු මිය යනවා කියන්නෙ කුමක් ද එය ඊනියා මොළය මරණයට පත් වීම ද වෙනත් එකක් ද
146519,සෛල බෙදි බෙදී කළලය ක්‍රමයෙන් මවු කුස තුළ වැඩෙයි
25615,එකම සෛලය දෙකට බෙදීමෙන් බිහිවන නිවුන් දරුවන් වෙනස්වන්නේ ඇයි දැයි බටහිර ජීවවිද්‍යාවට තේරුමි කළ හැකි ද හැකිනමි එසේ තේරුමි කරන ලෙස අපි අභියෝග කරමු
143680,සිරුරක් මත හරි සිරුරේ හරි වෛරසය පැවතීම කියන එක හා වෛරසය ජෛවී සෛලයක ප්‍රජනනය වීම කියන්නෙ දෙකක්
106070,භූමදාන කළොත් වෛරසය ඒ සෛලවල ගුණනය වේවි
133082,වයිරසය වැඩෙන්නේ ජීවියකුගේ සෛලවල කියනවා
130810,රිදෙනවා කියන්නේ මනසට සෛලවලින් යමක් සන්නිවේදනය වන බව
36040,එහි අජීවයෙන් ජීවය ඇති වී ඉන්පසු බහු සෛලික සංකීර්ණ සත්ත්වයන් ඇති වී මොළය නම් ඉන්ද්‍රිය ඇති වී මනස ඇති වෙයි
36281,එහි එකම අරමුණ සිංහලුන් බිය වද්දා වෙල්ලාලයන්ට බලය ලබාගෙන රටේ ස්වෛරීභාවය නැති කිරීම ය
52296,ඒ නිසා ස්වයං පාලනය හෝ බලය බෙදාගැනීම පිටුපස ඇත්තේ තමන්ට ස්වෛරී බවක් අත් කර ගැනීමේ අරමුණ නොවේයැයි ඔවුන්ට තර්ක කල නොහැක
90926,නමුත් ඔවුන් උතුරේ ස්වයං පාලනයක් නැත්නම් බලය බෙදාගැනීමක් සාධාරණය කරන්නේ අනන්‍යවූ ජාතියක් ලෙස ස්වෛරී රාජ්‍යයක වෙසීම දෙමළ ජනයාගේ අභිලාෂය බව පෙන්වමිනි
96404,පළාත් සභා මැතිවරණයට පෙර හා පසු දෙමළ නායකයින් තම ක්‍රියාකාරකම් තුලින් අපට ඉඟි කරන්නේ විශේෂයෙන්ම යාපනයේ දෙමළ ජනයාගේ අභිලාෂය අනන්‍යවූ ජාතියක් ලෙස ස්වෛරී රාජ්‍යයක වෙසීම බවය
68013,ඔවුහු ස්වෛරීභාවය බෙදාහදා ගැනීමක් කියති
52085,ඒ නිසා දෙමළ ජනයා උතුරේ ස්වෛරීය බවක් අත් කර ගැනීම තුලින් සිංහලුන්ගේ ස්වරීය බව නැතිවනු ඇත
143122,සිංහලුන්ගේ ස්වරීයභාවය නැති කරගනිමින් දෙමළුන්ට ස්වෛරීය බවක් අත් කර දිය යුතු යැයි කීම අසාධාරණය
137870,ශ්‍රී ලංකාවට ආණ්ඩුකම ව්‍යවස්ථාවක් සම්මත කර ගත යුතු යැයි ශ්‍රී ලාංකික ජනතාව අතර පුළුල් එකඟතාවයක් ඇති හෙයින් ද
9966,අපට අවශ්‍ය දෙමළ හා මුස්ලිම් ජනයාට ව්‍යාජ ඉතිහාසයක් හිමිකර සිංහලයන්ට මෙරට හිමි තැන නැති කිරීම නොව දැනටමත් සිංහලයන් ගොඩනගා ඇති ජාතියට දෙමළ හා මුස්ලිම් ජනයා ද ඇතුළත් කරගන්නේ කෙසේ ද යන්න සොයා බැලීමයි
10784,අපට පෙනෙන විවිධ පැහැය සහිත මල් ඒ විවිධ පැහැයෙන් ම සුසිනිදු බවකින් යුක්තව පවතින්නේ යැයි අපි සිතමු
108728,දෙමළ කතාකරන පිරිස මලබාර් යනුවෙන් හඳුන්වනු ලැබුවා
15206,අවශ්‍ය තැන ඒ යොදාගැනීම පමණක් නොව හැකිනම් හා අවශ්‍යතාවක් ඇත්නම් ඒ සිංහල බෞද්ධ සංස්කෘතියට අවශෝෂණය කර ගැනීමට ද අප උනන්දු විය යුතු ය
141112,සාමාන්‍යයෙන් චන්ද්‍ර මාසයක් ආරම්භ වන සූර්ය මාසයෙන් නොවෙයි අවසන් වන්නෙ
15319,අවශ්‍ය නමි ඒ සඳහා ඊළඟ අවුරුද්ද තෙක් කල්ගත හැකි ය දියුණු කරන ලද මනසට සූර්යයාට සාපේක්ෂව පෘථිවියේ චලනය දැකගත හැකි විය
59265,ඒත් අර අවුරුදු දෙකහමාරකට පමණ වරක් චන්ද්‍ර මාසයක් යම් සූර්ය මාසයකින් ආරම්භ වෙලා ඒ සූර්ය මාසයෙන් ම අවසන් වෙනවා
15793,අවුරුද්ද සිංහලයන්ගේ උත්සවයක් වුණත් අප එය සූර්යයා රේවති නැකතින් අස්විද නැකතට හරි මීනෙන් මේෂයට හරි සංක්‍රමණය වීම පදනම් කරගෙන පටන් ගත්තත් එහි ප්‍රධාන කාර්යය හිස තෙල් ගා ස්නානය කිරීම වුවත් අප සුපුරුදු පරිදි ඉන්දියාවේ හින්දු ආභාසය නිසා අද සූර්යයා මීනයෙන් මේෂයට යෑම පදනම් කරගෙන අවුරුද්ද පවත්වනවා
144544,සූර්යයා ගමන් නොකරන බවත් පෘථිවිය නමි සූර්යයා වටා චලනය වන බවත් එබැවින් මෙය මිථ්‍යාවක් බවත් පඬියන් කියනු ඇත
144545,සූර්යයා නැවත මේෂයට එන විට අප ශක්තිමත් නායකයකු පත්කර ගත යුතු ය
146239,හෙළයන් කියන්නෙ සූර්යයා සමග සම්බන්ධ කියන එක මිසක් හෙල්වල ජීවත් වූ අය නො වෙයි
15321,අවශ්‍ය නමි කෙනකුට සූර්යයාට සාපේක්ෂව පෘථිවියේ චලනය පදනමි කරගෙන ද අවුරුද්ද උදාවන ආකාරය ප්‍රකාශ කළ හැකි ය
19459,ඇර්ස්ටෝටල්ගෙ ද්විකෝටික න්‍යාය එක්ක උපකුලකයක අනුපූරකය අර්ථ දැක්වීමේ දී ම ප්‍රශ්න එනවා
75559,කුලකවාදය අනුව උපකුලකයක අනුපූරකය නිර්වචනය කරන්නේ කෙසේ ද අවයවයක් කුලකයට හෝ උපකුලකයට එක්කෝ අයත් විය යුතුයි
28699,එමෙන් ම එය ආහාර පරිපූරකයක් ලෙසත් අනුමත වෙලා තියෙනවා
126176,මෛත්‍රිපාලට තමාගෙම පූර්වාදර්ශයක් තියෙනවා
93224,නීතිය බූරුවෙක් කියලා කතාවක් තියෙනවා
86345,දහහතර වැනි වියේ පසු වූ අපට ඔහුට සෑහීමකට පත්වෙන පිළිතුරක් ලබා දෙන්න බැරි වුණා
77372,කෝල්බෘක් කැමරන් රාජකාරි ක්‍රමය අහෝසි කර ඉංගිරිසි වෙළෙඳ ආර්ථිකයක් ඇතිකිරීමෙන් පසු එ මගින් ඊනියා ප්‍රභූන් බවට පත්වූ සිංහල ක්‍රිස්තියානිහු ද වූහ
34118,එවැනි අවබෝධයක් තිබිණි නම් ඒ මහතා විදුසර සංග්‍රහයෙහි පිටු නාස්ති නොකරනු ඇත
44965,එහෙත් රජුට කුමරු අල්ලා දඬුවම් කිරීමේ අවශ්‍යතාවක් නො වීය
120080,මේ අතර බටහිරයන්ට මහින්ද පන්නා දැමීමේ අවශ්‍යතාව නැත්නම් රාජපක්ෂ රෙජිමය එළවා දැමීමේ අවශ්‍යතාව තිබුණා
71487,ඊනියා පොදු මතවාදයක් තුළට ගැනීම ද එසේත් නැතහොත් ඊනියා ස්වාභාවික වරණය ඊනියා පොදු මතවාදය බවට පත්කර ගැනීම ද යන්න ඔහු ලියන දෙයින් පැහැදිලි නො වේ
123648,මේ ලිපිය තමන්ට අවශ්‍ය පරිදි මගේ තෝරාගත් ලිපි පමණක් පළකරන පුවත්පත් වෙබ් අඩවි ආදිය සඳහා ඉදිරිපත් කරන්නේ නැහැ
9942,අපට අවශ්‍ය වන්නේ ප්‍රභාකරන් යනු හුදු ත්‍රස්තවාදියෙකු නොවූ බව අවධාරණය කිරීම ය
56391,ඒ සඳහා සමාධිය අවශ්‍ය ය
107084,මට ඔහු පෞද්ගලික ව මුණ ගැසීමේ අවශ්‍යතාවක් නැති බව දන්වනු කැමැත්තෙමි
118940,මෙලෙස එම ජලය විස්තර කොට ඇත්තේ එහි ජීවීන් බිහි වීමට අවශ්‍ය දේ තිබෙන බව පහදා දීම සඳහා ය
119711,මෙහි ප්‍රධාන කාර්යය වන්නේ ඇදහීම අරමුණු කරගෙන නිවන් දැකීම සඳහා අවශ්‍ය මානසික තත්වයන් මිනිස්සු තුල ගොඩ නැංවීමයි
123646,මේ ලිපිය තමන්ට අවශ්‍ය පරිදි මගේ තෝරාගත් ලිපි පමණක් පළකරන පුවත්පත් වෙබ් අඩවි ආදිය සඳහා ඉදිරිපත් කරන්නේ නැහැ
123647,මේ ලිපිය තමන්ට අවශ්‍ය පරිදි මගේ තෝරාගත් ලිපි පමණක් පළකරන පුවත්පත් වෙබ් අඩවි ආදිය සඳහා ඉදිරිපත් කරන්නේ නැහැ
124025,මේ විවාදය ලංකාවේ කෙරෙන ප්‍රසිද්ධ විවාදයක් ලෙස පැවැත්වීම මගේ අවශ්‍යතාව විය
104657,බුදුදහමට අනුව පුනරුත්පත්තිය සඳහා විඤ්ඤාණය අවශ්‍ය වන්නේ ය
120143,මේ අදහස ඔප්පු කිරීමට අවශ්‍ය සාක්‌ෂි ලෙස ඔවුන් පවසන්නේ එම ස්‌ථානයට සුළු රෝගයක්‌ වුව සෑදුණොත් මුළු විඤ්ඤාණය ම ක්‍රියා විරහිත වන බව ය
34132,එවැනි අවස්‌ථා දෙකේ ම ජීවීන්ට අවශ්‍ය දේවල් සෑදෙන්නේ නැත
106871,මට අවශ්‍ය වන්නේ එවැනි උසස් මට්ටමේ සිංහල බෞද්ධයන් මේ පරීක්ෂණය අර්ථකථනය කරන්නේ කෙසේ දැයි දැනගැනීම ය
139792,සම්පුර්ණ චිත්ත විසුද්ධියත් ඇති වීමට අර්පණා සමාධිය අවශ්‍ය ය
8075,අප ගේ මූලික අදහස වන්නේ අප ස්‌වභාවධර්මයට අවශ්‍ය සේවයක්‌ ඉටු කරන බව ය
19513,ඇල්ගොරිතමය යනුවෙන් අදහස්‌ වන්නේ යම්කිසි ගණිත ගැටලුවක්‌ නිශ්චිත පියවර ගණනකින් විසඳීමට අවශ්‍ය නීති රීති වන්නේ ය
123649,මේ ලිපිය තමන්ට අවශ්‍ය පරිදි මගේ තෝරාගත් ලිපි පමණක් පළකරන පුවත්පත් වෙබ් අඩවි ආදිය සඳහා ඉදිරිපත් කරන්නේ නැහැ
137253,ශක්‌තිය සැම ක්‍රියාවලියකට ම අවශ්‍ය වන්නේ ය
124026,මේ විවාදය ලංකාවේ කෙරෙන ප්‍රසිද්ධ විවාදයක් ලෙස පැවැත්වීම මගේ අවශ්‍යතාව විය
113254,මා ලියන දේ ඔහුට අවශ්‍ය පරිදි වෙනස්‌ කොටගෙන එය වැරැදි බව පවසා මා කිසිවක්‌ නො දන්නකු බව ඔප්පු කිරීමට තම කාලය ශක්‌තිය සහ අවකාශය වැය කරමින් පරිභව කිරීමට ඔහු තුළ ඇති සහජ හැකියාව විදහාපායි
107085,මට ඔහු පෞද්ගලික ව මුණ ගැසීමේ අවශ්‍යතාවක් නැති බව දන්වනු කැමැත්තෙමි
123650,මේ ලිපිය තමන්ට අවශ්‍ය පරිදි මගේ තෝරාගත් ලිපි පමණක් පළකරන පුවත්පත් වෙබ් අඩවි ආදිය සඳහා ඉදිරිපත් කරන්නේ නැහැ
123651,මේ ලිපිය තමන්ට අවශ්‍ය පරිදි මගේ තෝරාගත් ලිපි පමණක් පළකරන පුවත්පත් වෙබ් අඩවි ආදිය සඳහා ඉදිරිපත් කරන්නේ නැහැ
20873,ඉන් පෙර ලංකාවට පැමිණි සියළු ජනකොටස් සිංහල සංස්කෘතියට අවශෝෂණය වුනා
131008,රේඛීය චින්තනයක අර්ථ දැක්වීම් ගැන සඳහන් කරන විට කියැවෙන මූලික කරුණක් නම් යමක් දෙවැනි දෙයක් ඇසුරෙන් අර්ථ දක්වා ඇත්නම් ඒ දෙවැන්න පළමුවැන්න ආශ්‍රයෙන් අර්ථ දැක්විය නො යුතු බව ය
91684,නාලක හිමියෝ සෙන්පති කොබිබෑකඩුව මහතා ඉතා කිටිටුවෙන් ඇසුරු කළහ
13279,අපේ සූත්‍ර පිටකයට ජාතක පොතට මුල් තැන දෙන්න කටයුතු කරනවා නම් බටහිර නූතනත්වයට යට නොවෙනවා නම් අනාගත පරම්පරාවලට සිංහල බුද්ධාගමක් ඉතිරි වේවි
70897,ඔහු හිටපු කතානායක වන්නේ කවදා ද යන ප්‍රශ්නය පමණක් දැනට ඉතිරි වී තිබෙනවා
78771,ගෝඨාභය මන්ත්‍රීවරයකු ව නොසිටි බැවින් ඔහු පක්ෂයකින් ඉදිරිපත් වීම අනිවාර්ය වුනා
6403,අනෙක් අතට යම් අයුරකින් ගෝඨාභයට ඉදිරිපත් විය නොහැකි වුවොත් විකල්ප අපේක්ෂකයා රාජපක්ෂ කෙනකු ම විය යුතු ද මෙහි දී දරුණු ම ගණයේ අවස්ථාවාදියකු වූ චම්පක ඉදිරිපත් කරන කොන්දේසි ඔහුත් සමග ඉතිහාසයේ කුණු බක්කියට විසි කරන්න ඕනෙ
52193,ඒ නිසා මට ජනාධිපතිවරණයට ඉදිරිපත් වෙන්න බැහැ
54973,ඒ වගේ ම ජනාධිපතිවරණයට ඒ සංධානයෙන් අපේක්ෂකයකු ඉදිරිපත් කරන්න ඉඩ තියෙනවා
69625,ඔහු දැන් ජනාධිපතිවරණයට ඉදිරිපත් වීමට ව්‍යාපෘතියක නිරත වී ඉන්න බව පැහැදිලියි
119238,මෙහි ක්‍රිස්තියානි චින්තනය යනුවෙන් හැඳින්වෙන්නේ දහසයවැනි සියවසේ මාටින් ලූතර කතෝලික චින්තනයට එරෙහි ව ඉදිරිපත් කළ පෞද්ගලිකත්වයේ නිදහස මත පදනම් වූ චින්තනයයි
130382,රාජ්‍ය නොවන සංවිධාන බටහිර මතවාද ඉදිරිපත් කෙරෙන්නෙ ඊනියා වාස්තවික පදනමකින්
20938,ඉන්දියාවක් නොතිබු කලක ඉන්දියානුවකු සිටිය නොහැකියි
75971,කෙසේ වෙතත් ඉන්දියාවේ මැදිහත්වීමෙන් ඉඩම් බලතල පළාත් සභාවලට හිමිකර දීමට කටයුතු කළේ ය
28191,එබැවින් තර්කයක් ඉදිරිපත් කරන්න පුළුවන් හතරවැනි ව්‍යවස්ථාව තුන්වැනි ව්‍යවස්ථාව සමග බැඳී ඇති බවත් එබැවින් හතරවැනි ව්‍යවස්ථාව සංශෝධනය කිරීම සඳහාත් ජනමත විචාරණයක් අවශ්‍ය බවත්
120139,මේ අද ඉදිරිපත් කරන වාර්තාව වචන හරඹයකින් පස්සෙ නව ව්‍යවස්ථාව ලෙස ඉදිරිපත් කරන්න පුළුවන්
