index,corrected_sentence
89569,දෙවියන් වහන්සේ මියගියත් නැතත් බටහිර රටවල පල්ලිවල මිනිසුන් ගැවසුනත් නැතත් යුදෙවු ක්‍රිස්තියානි සංස්කෘතියට එය ප්‍රශ්නයක් නො වේ
96840,ප්‍රභාකරන්ගෙ ආගම මොකක් වුණත් ඔහු මෙහෙයවුණෙ බටහිර ක්‍රිස්තියානි පල්ලිවලින්
117854,මෙරට කිසි දා වැඩවසම් ක්‍රමයක් තිබී නැති බැවින් ප්‍රශ්නයේ වලංගු භාවයක් නැති බවත් එය ඇතැම් සරසවි ඇදුරන් විශ්වවිද්‍යාල පරීක්ෂණවල දී දෙන ප්‍රශ්නවලින් වෙනස් නොවන බවත් පමණක් සඳහන් කරමි
98745,පරීක්ෂණවලට මිනිසුන් මුල දි කැමති වුණෙ නැහැ
24104,උන්වහන්සේ ඇතැම් නියැදි මලයාසියාවේ පර්යේෂණාගාරයක පරීක්ෂා කරවීමට නම් කටයුතු කළහ
116501,මෙතෙක් කල් මේ වරද එනම් ජාතික ගීය දෙමළට පරිවර්තනය කර ව්‍යවස්ථාවේ සඳහන් කිරීම පිළිබඳ ව කිසිවක් නොකිරීම ගැන මම ජාතියෙන් සමාව අයදිමි
10551,අපට තේරෙන පරිදි නම් තිස්සට දුන් රජකම ආපසු ගැනීම සඳහා ගැමුණුට සටන් කිරීමට සිදුවිය
15201,අවශ්‍ය කෙනකුට විශ්‍රාම වැටුපට බල නොපාන පරිදි අවශ්‍ය නම් හැටේ දී විශ්‍රාම ගැනීමටත් පුළුවන් වෙන්න ඕන
27743,ඔහු කවුරුත් දන්නා පරිදි බටහිර ආර්ථික විද්‍යාඥයෙක්
50718,ඒ චක්‍රලේඛ අපේ රටේ තත්වයට ගැලපෙන පරිදි සකස් කර ගැනීමට මෙරට ජනතාවට අයිතිය තියෙනවා
80217,ජ වි පෙරමුණ ද පුරුදු පරිදි විප්ලවීය විරෝධතාව දැක්වූවා
119047,මෙවැනි අවස්ථාවල සුපුරුදු පරිදි කාලෝ ෆොන්සේකා හා නන්දදාස කෝදාගොඩ නිහඬ වෙනවා
138534,සකර්බර්ග් වම්මුන් ඇතුළු වම්මුන්ට තුට්ටු දෙකේ බටහිර අනුකාරකයන්ට සිවල් සංවිධානවලට ආදීන්ට තමන්ට අවශ්‍ය පරිදි සමාජවාදයක් ප්‍රජාතන්ත්‍රවාදයක් මානව හිතවාදයක් ගැන කතා කරමින් ජාතිකත්ව විරෝධී දේශපාලන පක්ෂයකට සහාය දෙන්නත් පුළුවන්
15277,අවශ්‍ය නම් දිස්ත්‍රික්ක විසිහයක් කර වරාය නගරය වෙන ම පරිපාලන දිස්ත්‍රික්කයක් කළ හැකියි
73594,කවුරුත් දන්නා පරිදි ඔහු ට්‍රොට්ස්කිවාදියෙක්
101769,බටහිර විද්‍යාව හා තාක්ෂණය කලින් කියා ඇති පරිදි ධනවාදය සමග බැඳී තියෙනවා
54355,ඒ මොකක් කීවත් මට ප්‍රශ්නයක් නැහැ
96930,ප්‍රවෘත්ති ද එසේ ම ය
96931,ප්‍රවෘත්ති සංස්කාරකවරුන්ට ඒවා තේරෙන්නේ නැහැ
36960,එහි දී බටහිරයෝ ඉන්දීය ශ්‍රෙෂ්ඨාධිකරණය පමණක් නොව ගාන්ධි පවුල ද යම් ප්‍රමාණයකට යොදාගත්හ
132119,ලැබෙන ප්‍රවෘත්ති අනුව ග්ලයිෆොසේට් ආනයනය කළ වෙනත් සමාගමක් තමන් ආනයනය කළ ප්‍රමාණය ආපසු යැවීමට පියවර ගෙන ඇත
132120,ලැබෙන ප්‍රවෘත්තිවලට අනුව නම් එහි නායකයන් අතර තාවෝවාදය අද අභාවයට යමින් පවතියි
115152,මිනිසුන් තර්කවලින් නිගමනවලට පැමිණෙන්නේ යැයි කීම කවුරුන් ඇති කරන ලද කතාවක් වුණත් වැඩ සිද්ධ වෙන්නේ එහෙම නො වෙයි
115666,මුක්තිය පිළිබඳ කතාව ප්‍රමූලධර්මවලින් පටන්ගෙන තර්ක කළහොත් වෙනත් නිගමනයකට පැමිණීමට හැකි බව අජිත් පෙරේරා විශ්වවිද්‍යාලයේ දී ඉගෙන ගත්තේ නැත්නම් එය ඔහුගේ ප්‍රශ්නයකි
101114,බටහිර මෙන් නොව මෙරට රථවාහන පැදවීමේ සංස්කෘතිය රටෙහි විකාශය වූවක් නො වෙයි
28704,එමෙන් ම එය පැරණි ශ්‍රී ල නි පක්ෂයත් නො වෙයි
144524,සූර්යයා වෘෂභයෙන් පිටත්වීමෙන් පසු සාකච්ඡාව නැවත ඇරඹීම වෘෂභයන්ට ප්‍රශ්නයක් විය හැකි ය
103280,බටහිරින් පෘතුගීසීන් ස්පාඤ්ඤයන් ප්‍රංශයන් ඉංගිරිසින් ලන්දේසීන් පමණක් නොව කුඩා රටක් වූ බෙල්ජියමෙන් පිටත්වූවන් ද අප රටවලට පැමිණි නැව්වල යුද්ධභටයන් මෙන් ම පූජකයෝ ද සිටියහ
4087,අද රනිල් වික්‍රමසිංහ මහතා දි මු ජයරත්න මහතා අගමැති ව සිටිය දීම මෛත්‍රිපාල සිරිසේන මහතාගේ ආධාරයෙන් අගමැතිකම පික්පොකට් ගැසුවේ මේ වගන්තිය අනුව ය
59191,ඒත් අපට පඬියන් නොවන ජනමාධ්‍යවේදීන් කී දෙනකු සිටිනවා ද අනෙක් අතට ආණ්ඩුවත් රාජ්‍ය විරෝධීව ව්‍යවස්ථාවට පිටින් කටයුතු කරනවා නම් උතුරු පළාත් සභාව ගැන මොනවා කියන්න ද ගුරා හිටගෙන කරන කොට ගෝලයා දුව දුව කරනවා කියලා තියෙන්නෙ කට කහනවට නොවෙයි
98457,පිටරැටියන් සමග ගිවිසුම ඇතිකරගෙන තිබෙන්නේ පෘතුගීසීන්
71332,ඔහුට අනුව එංගලන්තයේ විශ්වවිද්‍යාල වැඩකට නැති ශිෂ්‍යයන්ට උපාධි දී ඉක්මණින් පිටත්කර හරියි
16579,ආණ්ඩු පක්ෂයේ මන්ත්‍රීවරුන් පිහිකරුවන්ට විරුද්ධව කිසි ම පියවරක් නොගෙනීම ගැන සභා ගැබේ විරුද්ධත්වය පා තිබෙනවා
82639,ජී එල් පීරිස් කොළඹ විශාකා විදුහලේ පාලක මණ්ඩලයේ සාමාජිකයෙක්
1256,අද ඇතැම් සිංහල බෞද්ධයනටත් දෙමළ ජාතිවාදය ඉංගිරිසින්ගේ හා අනෙක් බටහිරයන්ගේ නිර්මාණයක් බව තේරෙන්නේ නැත්තේ ඔවුන්ගේ යටත්විජිතවාද විරෝධය ඕල්කට් බුද්ධාගමෙන් පීලි පන්නා ඇති නිසා
4401,අද වන විට බටහිර යටත්විජිතවාදී ඊනියා විවෘත ආර්ථිකය නව ක්‍රියාදාමයකට පිවිස ඇත
43214,එහෙත් ප්‍රවාද නොරිසි සිංහල බෞද්ධයෝ එය නො පිළිගනිති
12503,අපේ කණ්ඩායමේ අනෙක් අය සැබෑ විද්‍යාඥයන් ලෙස පිළිගැනීමට ලක්වීමට නම් මගේ අසම්මත ප්‍රකාශවලින් බැහැරවීමට වග බලාගත යුතු යැයි ද අදාළ නිවේදනයෙහි සඳහන් වෙයි
131895,ලක්ෂමන් පීරිස් නීති උපාධිධාරියකු වුණත් නීති මහාචාර්යවරයකු වුණත් නීති විද්‍යාලයේ පාඨමලාව හදාරන්න ගියේ නැහැ
98139,පැනි පරීක්ෂාවෙ ප්‍රතිඵල නොදෙන්න හේතුවක් තියෙනවා ද කී දෙනකුට පැනිය දුන්න ද පැනිය ඇත්තක් ද ඇත්තක් කියන්නෙ මොකක් ද ඇත්තක් කියල දෙයක් තියෙනවා ද බුදුදහමේ ඇත්තක් ගැන කියනවා ද බුදුහාමුදුරුවන් ඇත්තක් සොයා ගියේ ද
79067,චන්ද්‍රග්‍රහණයක දී පෘථිවියේ සෙවණැල්ලෙන් හඳ වැහිලා යනවා
49307,ඒ කැරකැවිල්ලට පෘථිවි අක්ෂයේ පූර්වායනය කියා කියනවා
141642,සිංහල නීතිය අද ලංකාව පුරා ක්‍රියාත්මක නූණත් එය තමයි මෙරට නීතිය
15263,අවශ්‍ය නම් කියන්න පුළුවන් අනාවැකි කරන්නේ සම්භාවිතාවක් ඇතිව බවත් ඒ නිසා අනාවැකි වරදින්න පුළුවන් බවත්
45672,එහෙත් සිංහල බෞද්ධ සංස්කෘතිය නැසීමට බටහිර ක්‍රිස්තියානි යටත්විජිතවාදය විසින් යොදා ගැණුනු ප්‍රධාන අවියක් වූ දෙමළ ත්‍රස්තවාදය පරාජය කිරීමෙන් ආණ්ඩුව කරන ලද සේවය
50370,ඒ ග්‍රීක යුදෙවු ක්‍රිස්තියානි චින්තනයේ ඊනියා ජාත්‍යන්තරවාදී බටහිර ක්‍රිස්තියානි ආධිපත්‍යයක් සහිත ලෝකය කඩාවැටීමක් ගැන
100187,එතුමා සඳහන් කෙළේ බුදුන් වහන්සේත් යමක් අත්හැරියේ තවත් යමක් අත්කර ගැනීමට බව
3155,අද පෞද්ගලික රෝහල් චැනල් සේවය බටහිර වෛද්‍ය ක්ෂෙත්‍රයේ දකින්න තියෙනවා
10960,අපට මේ බටහිරයන් පරාජය කළ හැකි ය
121811,මේ තම ලෝක ආධිපත්‍යය රැකගැනීමට බටහිරයන් ක්‍රියාකරන අන්දම
1193,අද ඇත්තේ බටහිරින් පුරුදු වෙච්ච පුරුදු කළ දේ
65754,ඔවුන්ගෙ සම්පූර්ණ උගත්කම ම බටහිරින් ලැබුණු එකක්
95130,පස්වැනි සියවසේ වැඩ විසූ උන්වන්සේ මහාවංසය තුන්වැනි සියවසෙන් නැවැත්වූයේ ඇයි එය ඉතිහාසයේ අවසානය ද අපේ යක්ෂයන්ට මොකද වුණේ භාරතීයයන් අපේ ඉතිහාසයෙන් යක්ෂයන් පන්නලා
119907,මෙහෙයුම් කමිටුවට ඉදිරිපත් කරපු ලියවිල්ල සකස් කරද්දි ඇමතිවරු මුකුත් කරන්න නැතිව ඇති
121902,මේ තීරණයෙන් සති කිහිපයකට පෙර සඳහන් කෙරුණු අයුරෙන් මෙයින් සිදුවන්නේ උසාවියේ නඩු වැළක් පැවරීම පමණකි
81772,ජාතික ආණ්ඩු සංකල්පය රනිල් මෛත්‍රී යමපාලනයේ තවත් ව්‍යාජයක් පමණකි
3888,අද මෛත්‍රීපාල සිරිසේන විජාතික බලවේගවල අපේක්ෂකයා වෙයි
14919,අරාබි වසන්තයෙහි ප්‍රතිඵලය ලෙස මෛත්‍රීපාල සිරිසේන පඹ ජනාධිපතිවරයා කිරීමේ අවශ්‍යතාව බටහිරයන්ට වෙයි
20396,ඉතාම දුර්වල අපේක්ෂකයකු වූ මෛත්‍රීපාල සිරිසේන ඊනියා පොදු අපේක්ෂකයා වන්නේ මේ සන්දර්භයෙහි ය
44870,එහෙත් මෛත්‍රීපාල සිරිසේනට දිනිය නොහැකි බව ඔවුහු දනිති
82155,ජාතික හෙළ උරුමය මෛත්‍රීපාල සිරිසේනට සහාය දීම හේතුවෙන් ඔහුගේ විජාතිකත්වය අඩු නොවේ
126383,මෛත්‍රීපාල සිරිසේන දෙමළ ජාතිවාදය
79122,චන්ද්‍රිකා කුමාරතුංග මගින් බටහිරයෝ මෛත්‍රීපාලට ජනාධිපති අපේක්ෂකයා වීමේ වැදගත්කම ලබා දී ඔහු ඊනියා පොදු අපේක්ෂකයා කළහ
32900,එයට ප්‍රධාන හේතුව වූයේ මහින්දගේ ජනාධිපතිවරණ ව්‍යාපාරය මෙහෙයවූවන් සිංහල ජාතිකත්වයට නිසි ලෙස ආමන්ත්‍රණය කිරීමට අපොහොසත් වීම ය
138554,සඟ වෙද ගුරු ගොවි කම්කරු රණවිරු බල වේගය සංවිධානය විය යුතු ය
89394,දෙවැන්නත් ඉටුකර ගෙන යනවා මෛත්‍රිපාල මොන බයිලා කිව්වත් අද රණවිරුවන් කිහිප දෙනකු හිරේ
53977,ඒ මහතා පසුගිය දා මහනුවර දී කීර්ති තෙන්නකෝන් මහතා සහභාගි වූ රැස්වීම ද මගහැරියේ ය
130788,රැස්වීමක් හෝ මාධ්‍ය සාකච්ඡාවක් හෝ පැවැත්වු විට ජනමාධ්‍ය තුන හතරකට වඩා සහභාගි වුනේ නැහැ
139470,සමහරවිට ඒ නිසා රැස්වීමක් තබාගැනීමට නොහැකි වූවා ද කියා දන්නේ නැහැ
54748,ඒ රැස්වීමට පැමිණි අය අතර අති විශාල බහුතරය මහින්ද රාජපක්ෂ මහතාට ඡන්දය දුන් අය වෙති
15518,අවසානයේ දී ඔවුන් මගේ ඡායාරූපය අනෙක් පීඨාධිපතිවරුන්ගේ ඡායාරූප එල්ලා ඇති පීඨ මණ්ඩල රැස්වීම් ශාලාවෙ එල්ලුවෙ නැහැ
5394,අදාළ රැස්වීමේ සිටි මවක නැගිට තම පුතා මිය ගියේ චන්ද්‍රිකාගේ කාලයේ බවත් එහෙත් ඒ මරණයෙන් රටට වැඩක් නොවූ බවත් නොකීම චන්ද්‍රිකාගේ වාසනාවක් යැයි අපට කිව නොහැක්කේ එතැනට කැඳවන ලද කාන්තාවන්ට ආරාධනය කළේ කවුදැයි අප නිච්චියට ම නොදන්නා බැවිනි
109789,මහින්ද රාජපක්ෂ මහතා රැස්වීමට පණිවුඩයක් එවමින් කියා සිටියේ රැස්වීමේ අභිලාෂයන්ට තමන්ට පිටු පෑ නොහැකි බව ය
109823,මහින්ද රාජපක්ෂ රැස්වීමට පණිවුඩයක් එවමින් කියා සිටියේ රැස්වීමේ අභිලාෂයන්ට තමන්ට පිටු පෑ නොහැකි බව ය
130789,රැකීමක් මිස රකින්නකු නැත
33370,එයට හේතුව වූයේ වරප්‍රසාද රැක ගැනීමයි
73417,කලින් සඳහන් කළ ආකාරයට දෙමළ නායකයන්ට සිංහලයන් බහුතරය බව නොපිළිගැනීමට ප්‍රධාන ම හේතුව වූයේ ඔවුන්ගේ වරප්‍රසාද රැක ගැනීමයි
108042,මධ්‍යයෙහි සිංහල බහුතරයක් ඇතිවීම වැළැක්විය නොහැකි නිසා තම වරප්‍රසාද අහිමි වන බැවින් හා බලය අඩුවන බැවින් වරප්‍රසාද රැක ගැනීමට හා බලය ලබා ගැනීමට තමන්ට බහුතරයක් විය හැකි ප්‍රදේශයක් වෙන ම රාජ්‍යයක් ලෙස වෙන් කරගැනීම ඊළාම් රාජ්‍යයට පසුබිම් වූ දර්ශනයයි
133154,වරප්‍රසාද ලත් බොහෝ අය කල්පනා කරන්නේ එම වරප්‍රසාද රැක ගැනීමටයි
46746,ඒ අතර තම කිතුණු කතෝලික අනන්‍යතාවත් රැක ගන්නවා
133152,වරප්‍රසාද රැක ගැනීම ඒ සඳහා ව්‍යවස්ථාදායක සභාවේ බලය ජන අනුපාතයට කිසිසේත් ම නොසරිලන අයුරකින් පවත්වාගත යුතු ය යන්න හා එහි දී සිංහලයන් බහුතරය බව නොපිළිගැනීම ආදිය ඒ ඉල්ලීමෙහි අඩංගු වුණා
124835,මේ සියලූ ඉල්ලීම්වලට පදනම් වූයේ තම වරප්‍රසාද රැක ගැනීමට හා බලය බෙදා හදාගැනීමට දෙමළ නායකයන් සිංහල ජනතාව බහුතරයක් බව පිළිගැනීමට තිබූ අකැමැත්තයි
128340,රටේ ඉතිහාසය සමග බද්ධ වී සිංහලයන් බහුතරය ලෙස පිළිගතහොත් තම ජන අනුපාතය වඩා තමන් ලබාගෙන ඇති වරප්‍රසාද  රැක ගැනීමට ඔවුන්ට නොහැකි වන බව ඔවුන් වටහා ගත්තා
60624,ඒත් ප්‍රශ්නය වූයේ දෙමළ ජනයා ගේ වරප්‍රසාද රැක ගැනීමේ දී මේ වරප්‍රසාදත් එක්ක බලය පිළිබඳ ප්‍රශ්නයත් ඈඳුණා
111307,මා කලින් කී අයුරින් ම දෙමළ ජනයාට තිබුණේ බ්‍රිතාන්‍යයන් යටතේ තමන් ලත් වරප්‍රසාද හා බලය රැක ගැනීමේ ප්‍රශ්නයයි
43448,එහෙත් ප්‍රතිශතයක් ලෙස ගත් කල යාපනයේ ජනතාව ගෙන් සෑහෙන කොටසකට ආණ්ඩුවේ රැකියා තනතුරු ආදිය ලැබුණා
62402,ඔව් ඒත් ඉන් කියැවෙන්නේ නැහැ සියලූ ක්‍රිස්තියානීන්ට හා කතෝලිකයන්ට රැකියා ලැබුණා කියලා
130790,රැකියා හා වෘත්තීන්වල තිබූ වරප්‍රසාදවලටත් වඩා එක් අතකින් ගත් කල දේශපාලන බලය පිළිබඳ ව ඉංගිරිසින් විසින් දෙමළ ජනතාව ගේ හිත්වලට දමන ලද අනුපාතය මෙහි දී ප්‍රධාන වශයෙන් බලපා තිබෙන බවක් පේනවා
142531,සිංහල සංස්කෘතිය තුළ ම පැහැදිලි අනන්‍යතාවක් ඇති ව කිතුනුවන් හා කතෝලිකයන් ලෙස ජීවත් වීමටත් තම ජනගහන අනුපාතයට නොසරිලන ලෙස රැකියා ආදිය බලාපොරොත්තු නොවීමටත් ඔවුන් ඉගෙන ගෙන තිබෙනවා
142809,සිංහලයන් බහුතරය බව පිළිගතහොත් ජන අනුපාතයට වඩා රැකියා හා වෘත්තීන්හි තමන් යෙදී සිටීම ගැටලුවක් වන බව ඔවුන් දුටුවා
127496,යාපනයේ දිස්ත්‍රික්කයේ ජන අනුපාතය සියයට පහක් හයක් පමණ වුවත් මේ වෘත්තීන් හා රැකියාවල යෙදුණු අය ඒ අනුපාතය වගේ හත් අට ගුණයක් වුණා
24002,උදාහරණයක් ලෙස මැද පෙරදිග රැකියාවලට ලංකාව ඇතුළු ආසියාතික රටවලින් යන අය ඒ රටවල ආර්ථිකය නගාසිටුවීම සඳහා විශාල කාර්යයක් කරනවා
130791,රැකියාවලට වෘත්තීන්ට පත් වීමේ දී බෞද්ධයන් තම අනුපාතයට සරිලන අයුරින් ඒවාට පත් වීම අද කිතුණුවන් ගෙන් හා කතෝලිකයන් ගෙන් බහුතරයකට ප්‍රශ්නයක් නොවෙයි
68521,ඔහු එක් රැයකින් වීරයෙක් විය
32270,එය සිංහලෙන් හා ඉංගිරිසියෙන් පෙඩරල් කියා හැඳින්වූයේ අපව රැවටීමටයි
63761,ඔවුන් තම පක්ෂය පෙඩරල් නමින් හැඳින්වූයේ සිංහල ජනතාව රැවටීමටයි
75599,කුසලය රැස් කරන ලද්දේ ද ඒ කරණ කොටගෙන ලෝකය භවසාගර දුකෙන් මිදුණක් වේවා
