index,corrected_sentence
91420,සමානකම් තියෙනවා
116436,මෙතන ගැනත් කියන්න ඕන
131221,ලස්සන ගෙයක්
131222,මෙම පක්ෂවලට අවුරුදු හැත්තෑවට වඩා වැඩි ය
131223,මෙම පක්ෂය කතා කළත් වැඩක් නැහැ
131225,මෙම අකුරු ශබ්ද කරන කොට දිව යන තැන් වෙනස්
131226,මෙම භේද බොහෝ විට දිව යන තැන ගැන කල්පනාවෙන් පසුවුවහොත් විසඳා ගන්න පුළුවන්
22056,ඉස්සර හෝඩියෙ අං කියල තිබුණෙ මේ ශබ්දය
33218,එයට හේතුව ඉංගිරිසි අකුරෙන් ලිවීම ය
85969,දහතුන ලියන්නෙ මෙලෙසයි
34550,එවිට දහය ලියන්නේ මෙලෙසයි
41464,එහෙත් ඔවුහු එය නිරපේක්ෂ චලිතයක් නොවන බව ද පසක් කරගෙන සිටියහ
65075,ඔවුන් වඩාත් සැලකිල්ලක් යොමු කර තිබුණේ ඇල්ලේ ගුණවංශ හාමුදුරුවන් හා මහින්ද රාජපක්ෂ ලිපි ගොනු ගැන කරපු කතාවලට
77299,වෙනත් ආකාරයකින්වත් ලියන්නේ නැහැ
104347,බිංදුව සංකේතය විකාශය වෙලා තියෙන්නේ
104857,බුදුන් වහන්සේට පසුව මගට පිළිපන් අඤ්ඤා කොණ්ඩඤ්ඤ මහතෙරුන් වහන්සේ කොණ්ඩඤ්ඤ හෙවත් ඤාණයේ මුදුණේ සිට අඤ්ඤා හෙවත් නොදන්නා තත්ත්වයට පත්වූයේ කෙසෙ දැයි අමරතුංග මහතා සිතා බලා ඇත් ද
104858,අරාබියේ හා චීනයේ විද්‍යාව දියුණු වූයේ යම් දර්ශනයක් මත පදනම් ව බව අමරතුංග මහතා සඳහන් කරයි
129463,රනිල් වික්‍රමසිංහ මහතා සහ මෛත්‍රිපාල සිරිසේන මහතා තව තවත් සංධාන නායකයන් හා සිංහල ජාතිකවාදීන් අත් අඩංගුවට ගෙන මැර බලය යොදා මැතිවරණයක් පැවැත්වීමට ඉඩ ඇත
91521,නාථ දෙවියන් අප බොහෝ දෙනකුට ගෝචර නො වේ
42852,එහෙත් ධර්මයක් ක්ෂණයකටවත් පවතින්නේ ද ක්ෂණයක් යනු කුමක් ද ධර්මයක් යනු කුමක් ද ධර්මයක් ක්ෂණයකට වුවත් පවතින්නේ යැයි ගැනීම ආත්මවාදී ය
22969,ඊනියා යහපාලනය වෙනුවෙන්
2256,අද ජ වි පෙ අරලියගහ මන්දිරයේ කාමරයක සිරවී බටහිර යටත්විජිතවාදී යුදෙවු ක්‍රිස්තියානි සංස්කෘතියේ මාක්ස්වාදී ප්‍රභේදය වෙනුවෙන් පෙනී සිටියි
126646,මොවුන්ට අවශ්‍ය අපේ ස්වෛරීභාවය නැති කිරීමට ය
91846,නැත්නම් අනෙක් පැත්ත උඩුඅතට හැරී තිබිය යුතුයි
69970,ඔහු පිළිබඳ අදාළ පරීක්ෂණයේ ප්‍රතිඵල රැගත් කෝප් වාර්තාව දැන් පාර්ලිමේන්තුවට ඉදිරිපත් කළ නො හැකි ය
103197,බටහිරයන්ට ජාතික රාජ්‍ය සංකල්පය තිබුණට ජාතික රාජ්‍ය නැහැ
94320,පඬියන් මහමොළ කාරයන් යහපාලනයක් ගැන කතා කරන්නේ රටේ නිදහස අමතක කිරීමට මිස වෙනත් කරුණකට නො වේ
94828,පර්යේෂණ ක්‍රම නිරීක්ෂණ මාර්ග ලේඛනගත කිරීම ආදිය ඒ අතර විය
61958,ඔබ ජාතිභේද නැතිව දේශපාලනය කිරීම ගැන කීවත් පොදුජන පෙරමුණේ ඉන්න බොහෝ අය උත්සාහ කරන්නේ සිංහල ජාතිකවාදය වඩ වඩාත් ශක්තිමත් කරමින් බලයට එන්නයි
17692,ආසනික් එකම හේතුව කියලා අපිත් කියන්නෙ නැහැ
4626,අද ශ්‍රී ල නි පක්ෂයේ නිවට නායකත්වය සමග ඇත්තේ දණ්ඩට බිය වූ මන්ත්‍රීන් කිහිප දෙනකු හා චන්ද්‍රිකාගේ පැකේජ් මන්ත්‍රීන් කිහිප දෙනකු පමණ ය
26204,එක් පැත්තකින් අනුර ප්‍රියදර්ශන යාපා ශ්‍රී ල නි පක්ෂයේ ශාඛා සමිතිවලට නිල වශයෙන් මධ්‍යම කාරක සභා තීරණය දන්වා නැත
67967,ඔවුහු ශ්‍රී ල නි පක්ෂයේ ද ශ්‍රී ල නි පක්ෂය නායකත්වය දැරූ සංධානයේ ද ජනාධිපතිවරණ අපේක්ෂකයා වූ මහින්ද රාජපක්ෂට වැඩ කළෝ ද මෛත්‍රිපාල සිරිසේන මහින්ද රාජපක්ෂට විරුද්ධව වෙනත් පක්ෂයකින් ජනාධිපතිවරණයට ඉදිරිපත්වීම ම තදබල වරදකි
79984,ජ වි පෙ නායකයන් වයසට ගියත් ඔවුන්ගේ ළදරු වලිකුලප්පුව සුව වී නැත
109830,මහින්ද රාජපක්ෂ ශ්‍රී ල නි පක්ෂයට ද්‍රෝහි වී නැත
109900,මහින්ද ශ්‍රී ල නි පක්ෂයේ ද එක්සත් ජනතා නිදහස් සංධානයේ ද නායකයා වීම එළඹෙන මැතිවරණයේ දී ශ්‍රී ල නි පක්ෂයට මෙන් ම සංධානයට ද වාසියක් වනු ඇත
110144,මහින්දට ශ්‍රී ල නි පක්ෂයට අවශ්‍ය වනවාට වඩා අද ශ්‍රී ල නි පක්ෂයට මහින්ද අවශ්‍ය වෙයි
117650,මෙරට ඇති දහස් ගණන් ලෙන් වලගම්බා රජුගේ නිර්මාණ නොව යක්ෂ ගෝත්‍රිකයන් බෞද්ධයන් වීමට පෙර සෘෂිවරුන් වෙනුවෙනුත් බෞද්ධයන් වූ පසු භික්ෂූන් වහන්සේලා වෙනුවෙනුත් නිර්මාණය කරන ලද ආරාම යැයි කිව හැකි ය
137344,ශ්‍රී ල නි පක්ෂ පාර්ලිමේන්තු කණ්ඩායමේ මහින්දට වඩා මෛත්‍රිපාලට කැමැත්තක් විය
137345,ශ්‍රී ල නි පක්ෂයේ මහජන නියෝජිතයන්ට මධ්‍යම කාරක සභා තීරණය නිල වශයෙන් දන්වා නොමැති බව අපට පිළිගත හැකි ය
137346,ශ්‍රී ල නි පක්ෂය ද රට ද පක්ෂයේ සාමාජිකයන් නොවන කිහිප දෙනකුගේ හා පක්ෂයට ද්‍රෝහි වූවන් කිහිප දෙනකුගේ ආධිපත්‍යයට ගොදුරු වෙමින් පවතියි
137347,ශ්‍රී ල නි පක්ෂය ධනපති විරෝධී ද නැද්ද යන්න මෙහි දී ප්‍රශ්නයක් නො වේ
137348,ශ්‍රී ල නි පක්ෂයේ නිවට නායකයන් කිහිප දෙනකු නොවන්නට මෛත්‍රිපාල රාජිත ආදීන් පක්ෂයෙන් අස්කළ යුතුව තිබිණි
137349,ශ්‍රී ල නි පක්ෂයේ මෛත්‍රිපාල රාජිත වැනි කැබිනට් ඇමතිකම් දරන්නන්ට ද ආණ්ඩුවේ විපක්ෂ නායක ඇතුළු ශ්‍රී ල නි පක්ෂයේ අනෙක් ඉහළ නායකයන්ට ද ඒ හඬ කන් බිහිරි කරන හඬක් බවට පත් වී ඇත
90521,නගරයේ රැකියා කරන මධ්‍යම පංතික උගතුන් නම් පොරවෙන හැටි දනිති
53344,ඒ බව අපි මේ වෙබ් අඩවියේ පළ වී ඇති ලිපි කිහිපයකින් ම ප්‍රකාශ කළෙමු
20608,ඉදිරි මැතිවරණයේ දී එය එසේ ම සිදු නොවන බව මෛත්‍රිපාල කෙසේ වෙතත් රනිල් දනියි
100185,ඒ සභාවේ දී
89720,දේශීය ධනපති පංතිය සුළු ධනේෂ්වරය ආදී සංකල්ප ව්‍යාජ පඬියන්ට කතා කිරීමට හොඳ මාතෘකා මිස සතපහකට වැඩක් ඇති සංකල්ප නො වේ
73903,ක්වොන්ටම් භෞතිකයෙහි සංඛ්‍යාතියක් ඇති ෆෝටෝනයක ශක්තිය මේ ලෙස දැක්විය හැකි ය
102160,බටහිර විශ්වවේදීන් එහි අගය තේරුම් කරන්නේ කෙසේ ද ඔවුන්ට ඒ සඳහා මානවකේන්ද්‍රීය නොවන පට්ටපල් බොරුවක් ගෙතිය හැකි ද
71105,ඔහුගේ දැනුම් පද්ධතිය අනුව බුදුන් වහන්සේ මිසදිටුවකු වන්නේ නැද්ද එසේත් නැත්නම් ටියුඩර් කියන්නේ බුදුන් වහන්සේ බුදුදහමට අනුව මිසදිටුවකු නොවන බවත් එහෙත් සිදුහත් කුමරු දහමට සාපේක්ෂව මිසදිටුවකු බවත් ද ටියුවර් කියන්නේ බුදු දහමට අනුව මිසදිටු නොවීමට නිවන් අවබෝධ කරගත යුතු බව ද
71106,ටියුඩර් කියන අන්දමට අප සියළු දෙනාත් මිසදිටුවන් වෙන්න ඕන
86366,දළ ජාතික නිෂ්පාදිතය ගණනය කරන්නේ කෙසේ ද යන්න නොදත් දේශපාලන විද්‍යාව උගන්වන කථිකාචාර්යවරු ද වෙති
98550,පිරිනිවන් පෑමෙන් පසුව මනස විඥානය ආදියෙහි පැවැත්ම පිළිබඳ ව එවැනි ම වූ පිළිතුරක් දිය හැකි නො වේ
9595,අප ස්‌වභාවධර්මයට අවශ්‍ය ප්‍රෝටීන නිෂ්පාදනය කරමින් සිටියි
82767,ජීවීන් ගේ මරණයට පසු ප්‍රෝටීන ඉතිරි වන ලෙස සැකසී ඇත්තේ ඇයි එසේ නම් ජීවීන් ගේ ජීවිතයේ අරුත ප්‍රෝටීන නිර්මාණය කිරීම විය යුතු ය
106779,මගේ විශ්වාසය සිංහලයන් පළමු වරට ශුන්‍ය සඳහා සංකේතයක් නිර්මාණය කළ බවයි
140831,සාදු සාදු සාදු අපට ඊනියා විද්‍යාත්මක බුදුදහමේ ශාස්තෘන් කෙනකු පහළ වී ඇත
17475,ආයුර්වේදයෙන් සුව වන්නේ තුන්වැනි වර්ගයේ රෝග ය
68618,ඔහු එසේ කියන්නේ ආයුර්වේදය ද බටහිර විද්‍යාව ද එක ම විද්‍යාවක්‌ යෑයි කියන අතර ය
8002,අප එලෙස ලියන්නේ නැහැ
23989,උදාහරණයක් ලෙස ගතහොත් සාධාරණ ව ත්‍රිකෝණයක කෝණ තුනෙහි එකතුව සෘජුකෝණ දෙකක් බව සාධනය කරනු ලැබිණි
16614,ආණ්ඩුකම ව්‍යවස්ථා මණ්ඩලය පත්කිරීම සඳහා යෝජනා සම්මතය
1677,අද එය නැවත ක්‍රියාත්මක කිරීම ප්‍රායෝගික නොවුණත් සෛද්ධාන්තික වශයෙන් ගත්කල එහි දොසක් දැකිය හැක්කේ ප්‍රමිතිකරණය යනු කුමක් දැයි නොදත් සිංහල විරෝධී කසිකබල් සතිඅන්ත පුවත්පත් කතුවරයකුට හා වෙනත් එවැනි පඬියන්ට පමණකි
5000,අද සෛද්ධාන්තික භෞතික විද්‍යාඥයකුට ඉතිහාසගත වීමේ අවස්ථාව උදා වී ඇත
5418,අදාළ සෛද්ධාන්තික දැනුම ලබාගත යුතු ය
10266,අපට ඒ කසිකබල් දැනුම සෛද්ධාන්තික තලයේ පැරදවීමට හැකි විය
10816,අපට බටහිර ගණිතය බටහිර සෛද්ධාන්තික නැත්නම්
11515,අපි එකල සිංහල බෞද්ධ ක්‍රමය විකල්පය ලෙස සලකමින් සෛද්ධාන්තික ව ඒ පිළිබඳ හැදෑරුවෙමු
16035,අවුරුදු විසිපහක පමණ කාලයක් මා විසින් බොහෝ විට ආචාර්යවරයකු ලෙස තනිවම එහෙත් කොළඹ හා කැලණියේ ශිෂ්‍යයන්ගේ ද ආධාරය සහිතව සෛද්ධාන්තික මටිටමක කරන ලද අධ්‍යයන දැන් තවත් ආචාර්යවරුන් කිහිප දෙනකු සමගින් ශිෂ්‍යයන් ද එකතු කරගෙන ප්‍රායෝගික ව කිරීමට ඉඩක් ලැබී ඇත
20868,ඉන් පෙර මා සිතා සිටියේ සෛද්ධාන්තික භෞතික විද්‍යාව පිළිබඳ විශාරදයකු වීමට ය
33334,එයට හේතුව මගේ මනසට එය බටහිර ගණිතය හෝ බටහිර සෛද්ධාන්තික භෞතික විද්‍යාව හෝ තරම්වත් සෛද්ධාන්තිකව පොහොසත් නො වීම ය
39304,එහෙත් උසස් පෙළ පරීක්ෂණයෙහි දී එකල තිබූ ලකුණු ලබාදීමේ පටිපාටිය අනුව භෞතික විද්‍යාව අසමත් වූ ඇතැම් වර්තමාන මහාචාර්යවරු බටහිර ගණිතය පිළිබඳ මනා අවබෝධයක් හෝ අයින්ස්ටයින්ගේ අන්තර්ඥානය හෝ නොමැතිව බටහිර භෞතික විද්‍යාව පිළිබඳ ජනප්‍රිය පොතපත කියවා බටහිර සෛද්ධාන්තික භෞතික විද්‍යාවේ දර්ශනය පිළිබඳ විහිළු සපයති
39896,එහෙත් එයට පෙර ඔහුට ක්වොන්ටම් භෞතිකය ඇතුළු සෛද්ධාන්තික භෞතිකය තේරුම් ගැනීමට තබා සරල සිංහලෙන් ලියූ ප්‍රකාශයක්වත් කියවා තේරුම් ගැනීමට තරම්වත් හැකියාවක් නැති බව එක් උදාහරණයකින් දැක්වීමට කැමැත්තෙමි
44012,එහෙත් මම බටහිර ගණිතයට හා සෛද්ධාන්තික භෞතික විද්‍යාවට ප්‍රිය කළෙමි
47078,ඒ අතින් ගතහොත් ගැලීලියෝ පරීක්ෂණාත්මක විද්‍යාඥයකු විණි නම් නිව්ටන් සෛද්ධාන්තික විද්‍යාඥයෙක් විය
55156,ඒ වයස මිස ඔහු සෛද්ධාන්තික භෞතික විද්‍යාව හැදෑරීමට ගතකල කාලය නො වේ
57470,ඒ සෛද්ධාන්තික නැත්නම් ප්‍රවාදාත්මක භෞතික විද්‍යාඥයන් අතින්
66563,ඔවුන්ට අවශ්‍ය සෛද්ධාන්තික ගණිතමය සංගත බව පමණකි
68908,ඔහු කැනඩා ජාතික පර්යේෂණ මණ්ඩලයේ   ක්වොන්ටම් භෞතික විද්‍යා අංශයේ ද මොන්ට්‍රියල් විශ්වවිද්‍යාලයේ සෛද්ධාන්තික භෞතික විද්‍යා අංශයෙහි ද සේවය කරන්නේ යැයි කියැවෙයි
70045,ඔහු බටහිර සෛද්ධාන්තික භෞතික විද්‍යාව හැදෑරීමට අවුරුදු විසිපහක් ගතකර නොතිබිණි
73927,ක්වොන්ටම් භෞතිකයේ සෛද්ධාන්තික වර්ධනය ඇණ හිටීමෙන් පෙන්නුම් කරන්නේ ඒ බව ය
79085,චන්ද්‍රසිරි ධර්මවර්ධන නොදැන සිටියාට ප්‍රභාකරන් පැරදවිය නොහැකිය යන බටහිර දැනුම අපි සෛද්ධාන්තික ව පරාජය කෙළෙමු
100578,බටහිර ගණිතය හා සෛද්ධාන්තික භෞතික විද්‍යාව ඉතා වියුක්ත ය
101072,බටහිර භෞතික විද්‍යාවේ පසුගිය අවුරුදු අසූවක පමණ කාලයක අළුත් සෛද්ධාන්තික වර්ධනයක් වී නැත
102148,බටහිර වියුක්ත ගණිතය ගැන එතරම් අවබෝධයක් නොමැතිව බටහිර සෛද්ධාන්තික භෞතික විද්‍යාච පිළිබඳ අවබෝධයක් ලබාැනීමට අයින්ස්ටයින්ගේ ගණයේ අන්තර්ඥානයක් තිබිය යුතු ය
102531,බටහිර සෛද්ධාන්තික භෞතික විද්‍යාවෙහි ප්‍රතිඵල මැණීය හැකි ආකාරයකින් බොහෝ විට ඉදිරිපත් කෙරෙයි
105221,බොහෝ අයට බටහිර සෛද්ධාන්තික භෞතික විද්‍යාව හැදෑරීමට බටහිර වියුක්ත ගණිතය අත්‍යවශ්‍ය වෙයි
105365,බොහෝ දෙනා නොදැන සිටියාට ප්‍රභාකරන් පැරදවිය නොහැකිය යන බටහිර දැනුම අපි සෛද්ධාන්තික ව පරාජය කෙළෙමු
111763,මා ගණිතය පිළිබඳ රජයේ ශිෂ්‍යත්වය දිනාගෙන ඒ වයසේ දී එංගලන්තයේ සසෙක්ස් විශ්වවිද්‍යාලයට ඇතුල් වූයේ බටහිර සෛද්ධාන්තික භෞතික විද්‍යාඥයකු වීමට ය
111764,මා ගණිතය පිළිබඳ රජයේ ශිෂ්‍යත්වය දිනාගෙන ඒ වයසේ දී සසෙක්ස් විශ්වවිද්‍යාලයට ඇතුල් වූයේ බටහිර සෛද්ධාන්තික භෞතික විද්‍යාඥයකු වීමට ය
114760,මැතිවරණ ප්‍රකාශයකින් සෛද්ධාන්තික ව කෙරෙන්නේ මේ ආකර්ෂණීය වන්නේ යැයි සිතන කොටස් අදාළ ඡන්දදායකයන්ට ඉදිරිපත්කර ඔවුන්ගේ ඡන්දය දිනාගැනීම ය
117066,මෙය මුළුමනින් ම සංකල්පීය හා සෛද්ධාන්තික වශයෙන් ගත්කල දෝෂ සහිත ය
122633,මේ ප්‍රවෘත්තිය මුල්වරට මා ඇසූ අවස්ථාවෙහි මට මතක් වූයේ අවුරුදු හතළිස් අටකට පෙර මා බටහිර සෛද්ධාන්තික භෞතික විද්‍යාඥයකු ව්‍යවහාරික ගණිතඥයකු වීමේ පරම පවිත්‍ර ඒකායන අරමුණින් පේරාදෙණිය විශ්වවිිද්‍යාලයේ බටහිර විද්‍යා පීඨයේ පළමු වසර සිසුවකු ලෙස ඇතුල් වී වැඩිකල් නොගොස් අසන්නට ලැබුණු බයිලාවකි
123138,මේ මහාචාර්යවරුන්ට අනුව බටහිර රටවල විද්‍යාවේ දර්ශනය ගැන කතාකරන්නන් බොහෝ විට බටහිර සෛද්ධාන්තික භෞතික විද්‍යාඥයන් වුව ද ලකොවේ ජෛවීය විද්‍යා අංශවල මහාචාර්යවරු බටහිර විද්‍යාවේ දර්ශනය ගැන කතාකිරීමට බොහෝ විට පෙළඹෙති
128257,රටට නොව තම ආයතනයේ සේවය කරන අනෙක් අයගේ වැටුපට කුමක් වේ ද තම වැටුප පමණක් වැඩිකර ගැනීමෙන් ආයතනයේ ස්ථායිතාවට කුමක් වේද යන්න පිළිබඳව සිතන අය කෙතෙක් වෙත් ද ජ වි පෙරමුණට ඒ පිළිබඳ සෛද්ධාන්තික විශ්ලේෂණයක් නැතිවුවත් ඔවුහු තම පැවැත්ම සඳහා ආයතන අස්ථායි කිරීමට ක්‍රියාකරන බව පැහැදිලි ය
132845,වඩාත් ම දක්ෂ බටහිර සෛද්ධාන්තික භෞතික විද්‍යාඥයෝ හා බටහිර දාර්ශනිකයෝ බටහිර යුරෝපයේ නැගෙනහිරට වූ රටවල් වන ඕස්ට්‍රියාව සුප්‍රසිද්ධ වියනා කවය නම් දාර්ශනිකයන්ගේ කවය ඕස්ට්‍රියාවෙහි අගනුවර වූ වියනා නගරය ආශ්‍රිත ව බිහිවිය
